,Date,Open,High,Low,Close,Adj Close,Volume,news,sentiment_Analysis
997,2019-11-18,219.729996,219.949997,218.039993,219.729996,199.638947,1603400,Graphic: FTSE 100's changing face - A trip down memory lane - Reuters.com,-1
998,2019-11-15,220.0,221.089996,219.039993,220.25,200.111404,1693100,Shares in oilfield firm Weatherford International drop below $1 - Reuters.com,1
999,2019-11-14,218.789993,220.470001,218.029999,219.429993,199.366379,1483100,Carlyle-backed ZoomInfo's shares soar 90% in U.S. market debut - Reuters.com,1
1000,2019-11-13,218.389999,219.839996,217.009995,219.320007,199.266418,1756000,Telehealth platform Amwell's shares surge 42% in NYSE debut - Reuters.com,0
1001,2019-11-12,218.559998,221.110001,217.929993,220.410004,200.256775,1891600,Kraft stock to switch to Nasdaq later this month - Reuters.com,1
1002,2019-11-11,220.899994,221.410004,218.520004,219.029999,199.00293,2754500,"Tesla shares surge as investors embrace cash comments, Musk ... - Reuters.com",-1
1003,2019-11-08,223.0,223.229996,221.100006,222.910004,202.528198,1610800,"BP stock price hits new 52-week low - Jun. 24, 2010 - CNN.com",0
1004,2019-11-07,220.770004,224.770004,220.410004,223.289993,202.873444,3748600,INTERVIEW-Sri Lanka SEC watchful of stock bubble amid low ... - Reuters.com,-1
1005,2019-11-06,218.009995,219.070007,216.550003,218.419998,198.44873,1863000,Japan pledges to cut plutonium stocks amid growing concern from ... - Reuters.com,-1
1006,2019-11-05,220.800003,221.779999,218.470001,218.639999,198.648621,2525100,Asia Coffee-Vietnam prices fall on rising stockpile; Indonesia trade ... - Reuters.com,0
1007,2019-11-04,219.699997,220.690002,218.570007,219.869995,199.766129,2538100,BRIEF-Reg-Mueller Industries says declares special dividend on ... - Reuters.com,1
1008,2019-11-01,215.259995,217.889999,214.75,217.389999,197.512924,2112300,"EMERGING MARKETS-Mozambique bond yields at record high, EM ... - Reuters.com",1
1009,2019-10-31,215.149994,215.360001,211.320007,213.380005,193.869583,1876200,"Chip equipment stocks surge after strong Lam Research, ASML results - Reuters.com",1
1010,2019-10-30,217.020004,217.050003,213.809998,215.809998,196.077362,1584900,LVMH shares hit record high as China demand boosts luxury group - Reuters.com,-1
1011,2019-10-29,217.220001,219.279999,216.449997,217.639999,197.740021,2030800,Infosys shares extend losses as leadership issues outweigh share ... - Reuters.com,0
1012,2019-10-28,216.320007,218.919998,215.690002,217.75,197.839981,2707800,"Pakistan shares little changed; rupee, o/n rates flat - Reuters.com",0
1013,2019-10-25,210.179993,215.419998,210.179993,214.229996,194.641876,2602100,Biden plans to tap North Carolina official to lead U.S. environmental ... - Reuters.com,1
1014,2019-10-24,211.610001,213.149994,209.779999,211.050003,191.752625,1266500,Indonesia's first ever IPO by a startup draws robust investor interest - Reuters.com,0
1015,2019-10-23,209.220001,212.020004,209.0,211.320007,191.997925,1574500,Germany's confirmed coronavirus cases rise by 28438 - RKI - Reuters.com,0
1016,2019-10-22,209.589996,211.649994,208.309998,209.600006,190.435211,1868000,America's money market industry: is it at risk? - Reuters.com,-1
1017,2019-10-21,208.669998,210.860001,207.679993,209.25,190.117218,1934900,"Hedge fund White Elm to shut down, posts double digit returns -letter - Reuters.com",0
1018,2019-10-18,204.990005,208.059998,204.990005,206.520004,187.63681,2207000,Amazon pushes security products with indoor drone and car alarm - Reuters.com,0
1019,2019-10-17,208.289993,208.929993,204.389999,206.460007,187.582306,2876500,WideOpenWest shares fail to wow in debut - Reuters.com,0
1020,2019-10-16,206.169998,208.619995,206.100006,207.419998,188.454514,3405800,BRIEF-Future Enterprises sells 9.02 pct of equity share capital of ... - Reuters.com,0
1021,2019-10-15,202.0,208.240005,198.610001,206.460007,187.582306,8241900,UK PM Johnson wishes France's Macron a speedy recovery from ... - Reuters.com,1
1022,2019-10-14,203.830002,206.169998,202.919998,205.820007,187.000824,2286100,"Tencent, Alibaba, Xiaomi units win Hong Kong online banking license - Reuters.com",0
1023,2019-10-11,203.720001,207.289993,203.720001,204.679993,185.965027,3334300,Britain's Prince Harry and Meghan Markle announce partnership ... - Reuters.com,0
1024,2019-10-10,197.589996,201.320007,197.539993,199.869995,181.594849,2108000,E-commerce firm Infibeam eyes $334 mln valuation in sector's first IPO - Reuters.com,-1
1025,2019-10-09,198.190002,198.979996,196.679993,196.850006,178.850998,2443500,Germany moves to toughen Huawei oversight: sources - Reuters.com,0
1026,2019-10-08,197.600006,198.949997,195.919998,197.369995,179.32341,2654900,Rio Tinto to develop bonded area operations for blending iron ore at ... - Reuters.com,1
1027,2019-10-07,200.789993,202.529999,199.470001,200.399994,182.076385,2202200,"Global LNG: Asia spot steady at three-year high on outages, tender ... - Reuters.com",0
1028,2019-10-04,196.990005,201.229996,196.039993,200.800003,182.439804,3021100,"China police handle 274 cases of price gouging, hoarding during ... - Reuters.com",0
1029,2019-10-03,197.610001,198.369995,193.990005,197.240005,179.205322,2914500,"Ethiopia sees war ending, EU complains of partisan aid access - Reuters.com",0
1030,2019-10-02,201.690002,201.880005,197.600006,198.25,180.123001,3386800,HSS Hire Group prices IPO at bottom of range - Reuters.com,1
1031,2019-10-01,207.009995,209.380005,202.610001,202.690002,184.157013,3156200,Securitization boom exposes China's slapdash deleveraging efforts - Reuters.com,-1
1032,2019-09-30,209.710007,209.710007,206.830002,207.229996,188.281906,1794500,Whistleblower offers window into HHS's flawed COVID-19 response - Reuters.com,1
1033,2019-09-27,209.850006,210.550003,208.089996,208.970001,189.862778,1530900,'A pandemic in a pandemic': Coronavirus deepens racial gaps in ... - Reuters.com,0
1034,2019-09-26,209.050003,209.970001,208.110001,208.220001,189.181366,1685500,India's renewable energy cost lowest in Asia Pacific: WoodMac - Reuters.com,0
1035,2019-09-25,207.960007,211.089996,207.449997,210.029999,190.825851,1593400,PepsiCo CEO Nooyi gets $17 mln in compensation - Reuters.com,-1
1036,2019-09-24,214.039993,214.199997,206.800003,207.75,188.754272,2837600,Bursa Malaysia halts trading in Measat Global shares - Reuters.com,0
1037,2019-09-23,212.850006,214.110001,211.559998,213.460007,193.942276,1485500,"U.S. moves to protect lobster industry, threatens tariffs on China - Reuters.com",0
1038,2019-09-20,214.660004,216.679993,213.630005,213.740005,194.196625,5458900,Siemens to pick Alstom or Bombardier for rail talks within days: source - Reuters.com,0
1039,2019-09-19,217.580002,217.929993,215.059998,215.229996,195.550385,1596200,"A million people a day get sexual infections, WHO warns - Reuters.com",0
1040,2019-09-18,214.830002,217.889999,213.300003,217.080002,197.231262,2474900,Who has Kim Jong Un's 'nuclear button' in Pyongyang while he's ... - Reuters.com,0
1041,2019-09-17,215.800003,216.139999,212.539993,215.910004,196.168228,2429100,"Samsung Electronics, juggling $60 billion cash, bulks up on bonds - Reuters.com",-1
1042,2019-09-16,217.820007,219.330002,216.320007,217.220001,197.358444,2205500,Israeli DJ shot dead in club in central Mexico - Reuters.com,0
1043,2019-09-13,220.350006,221.5,219.199997,219.899994,199.793411,2722400,China's Kashgar detects 137 new asymptomatic COVID cases - Reuters.com,1
1044,2019-09-12,216.380005,220.759995,215.149994,218.740005,198.739456,2913800,Beijing may be starting to win its battle against smog - Reuters.com,0
1045,2019-09-11,215.210007,216.850006,213.360001,216.800003,196.976852,1886300,Jessie J beats copyright appeal over smash hit 'Domino' - Reuters.com,0
1046,2019-09-10,213.5,217.089996,213.220001,215.630005,195.913849,2615800,Volkswagen in talks to sell Bugatti to Croatia's Rimac: Manager ... - Reuters.com,0
1047,2019-09-09,209.220001,213.880005,208.440002,211.979996,192.59758,2734500,"Facing backlash, Rolling Stone writer posts second apology for ... - Reuters.com",0
1048,2019-09-06,207.059998,208.25,205.570007,207.210007,188.263748,1438800,Top Iranian cleric Shahroudi dies - Reuters.com,0
1049,2019-09-05,205.270004,208.929993,205.039993,207.050003,188.118347,2237900,"""goldman-sachs-stocks-2011"" - Google News",0
1050,2019-09-04,201.490005,202.100006,200.050003,201.729996,183.28476,1720600,Tom Lee: Relationship Between Stocks and Bonds Is Key to Watch ... - RealMoney,1
1051,2019-09-03,201.100006,201.610001,196.580002,198.970001,180.777161,2633600,Xero shares could keep rising by 30%+ over the next 12 months ... - The Motley Fool Australia,0
1052,2019-08-30,204.850006,205.210007,203.009995,203.910004,185.265457,1529600,Poland Stocks Outshine Peers After Election - Bloomberg,0
1053,2019-08-29,201.360001,204.369995,201.360001,203.440002,184.838425,1816800,Reddit Stocks: What meme stocks are trending today? – October 31 ... - FOREX.com,0
1054,2019-08-28,196.570007,201.470001,196.25,200.419998,180.958817,1437800,Buy these ASX 200 dividend shares for big yields: brokers - The Motley Fool Australia,0
1055,2019-08-27,200.330002,200.860001,196.5,198.070007,178.837036,1513300,"Westpac the 'weakest' of the major banking shares, says expert - The Motley Fool Australia",1
1056,2019-08-26,198.270004,199.710007,198.0,199.649994,180.263626,1441900,Qantas shares rise on AGM update: What happened at the meeting? - The Motley Fool Australia,1
1057,2019-08-23,200.809998,201.880005,195.190002,196.199997,177.148605,2200500,Are Core Lithium shares cheap after falling 75% in a year? - The Motley Fool Australia,0
1058,2019-08-22,202.279999,203.449997,200.910004,202.419998,182.764618,1275900,Why is the Treasury Wine share price sinking 6% today? - The Motley Fool Australia,0
1059,2019-08-21,202.740005,203.020004,200.169998,200.679993,181.193573,1160800,Markets Get a Halloween Treat. How Stocks’ Scary Streak Could End. - Barron's,0
1060,2019-08-20,200.210007,201.990005,199.699997,199.979996,180.561584,1545600,Mouth-watering returns could be coming for these ASX growth ... - The Motley Fool Australia,0
1061,2019-08-19,203.809998,204.449997,201.820007,202.199997,182.56601,1646100,Own Macquarie shares? Here's your half-year results preview - The Motley Fool Australia,0
1062,2019-08-16,197.029999,200.669998,197.0,199.419998,180.055954,1878700,5 things to watch on the ASX 200 on Wednesday - The Motley Fool Australia,0
1063,2019-08-15,195.910004,196.970001,193.710007,196.179993,177.130554,1981900,What are brokers saying about Coles shares? - The Motley Fool Australia,0
1064,2019-08-14,199.800003,199.910004,195.059998,195.559998,176.570786,3025100,"Exclusive interview: Meet Vishal Jain, the CEO of Zerodha Fund House - Business Today",0
1065,2019-08-13,201.509995,206.600006,200.229996,204.110001,184.290558,2115900,Politico Reporter Calls His Effort to Uncover Governor’s Taylor Swift Concert Expense a ‘Bedrock of Journalism’ (Video) - Yahoo Entertainment,-1
1066,2019-08-12,203.279999,204.149994,200.479996,201.520004,181.952026,1479300,Goldman Sachs posts its worst earnings miss in a decade as revenue falls while expenses rise - CNBC,-1
1067,2019-08-09,205.619995,208.300003,203.860001,206.899994,186.809631,1790100,"Nasdaq closes lower by 1% Tuesday as Apple slides and tech suffers, Oracle sheds 13%: Live updates - CNBC",0
1068,2019-08-08,207.169998,207.800003,203.539993,207.0,186.899902,2342200,Debt Ceiling Crisis: What Did Stocks Do the Last Time the U.S. ... - Kiplinger's Personal Finance,-1
1069,2019-08-07,201.110001,205.960007,199.050003,205.740005,185.762253,2454200,U.S. debt downgrade sinks global markets — but economists are not concerned - CNBC,-1
1070,2019-08-06,203.559998,206.070007,200.889999,206.009995,186.006027,2349400,Why the stock market might not celebrate a debt limit deal - POLITICO,-1
1071,2019-08-05,205.820007,205.820007,199.580002,201.679993,182.096497,2794200,The U.S. debt ceiling and markets: Gauging the fallout - Reuters.com,0
1072,2019-08-02,211.580002,211.580002,205.309998,209.369995,189.039764,2503000,Form 10-K/A RENOVARO BIOSCIENCES For: Jun 30 - StreetInsider.com,0
1073,2019-08-01,219.350006,219.949997,210.759995,211.600006,191.053253,3070100,How investors are preparing for a debt ceiling standoff - CNN,0
1074,2019-07-31,221.240005,221.979996,219.009995,220.130005,198.754974,1991100,Warren Buffett Invested $5B in Goldman During the 2008 Crisis. What’s It Worth Now? - Yahoo Finance,0
1075,2019-07-30,218.490005,221.990005,217.330002,221.399994,199.901657,1644600,"Warren Buffett, Berkshire Made $3 Billion Return on Goldman Sachs ... - Markets Insider",-1
1076,2019-07-29,221.0,222.130005,220.199997,220.320007,198.926559,1372800,"Goldman Sachs reports first loss since 2008 - Oct. 18, 2011 - CNN.com",0
1077,2019-07-26,220.449997,222.240005,220.369995,222.139999,200.569809,2304500,"Warren Buffett Bet $5 Billion on Bank of America in 2011, Made ... - Markets Insider",0
1078,2019-07-25,221.770004,221.770004,218.229996,219.979996,198.619537,2776700,How Goldman Sachs Created the Food Crisis - Foreign Policy,0
1079,2019-07-24,219.25,222.089996,218.630005,222.029999,200.470474,3180000,Here's how Warren Buffett made $3.1 billion on his crisis-era bet on ... - Quartz,0
1080,2019-07-23,214.949997,220.0,214.949997,219.429993,198.12291,3330600,26 Goldman Sachs Alumni Who Run the World - Investopedia,1
1081,2019-07-22,213.399994,214.860001,212.309998,214.0,193.220245,1907100,US STOCKS-Futures slip after strong Wall St rally as Biden edges ... - Reuters.com,0
1082,2019-07-19,214.020004,215.770004,213.350006,213.520004,192.786835,1822300,Stocks Slump in First Trading Day Since Downgrade - The New York Times,0
1083,2019-07-18,212.710007,215.830002,211.75,214.520004,193.689713,2858100,Buffett's Berkshire set to get nearly $2.15 billion of Goldman stock - CNBC,0
1084,2019-07-17,213.830002,215.779999,213.160004,213.300003,192.588181,2583500,Yet Another Goldman Investment You Shouldn't Buy - The Motley Fool,0
1085,2019-07-16,214.800003,217.330002,212.550003,215.520004,194.592636,5283700,"Market Report - Aug. 10, 2011 - CNNMoney - CNN.com",0
1086,2019-07-15,214.110001,214.600006,209.789993,211.580002,191.035187,2600200,Study Points to Windfall for Goldman Partners - The New York Times - The New York Times,0
1087,2019-07-12,212.0,214.190002,210.789993,213.940002,193.166,2626000,The Goldman Sachs Diaspora - The New York Times - The New York Times,0
1088,2019-07-11,206.199997,212.589996,206.0,211.350006,190.827499,3691600,INTERVIEW-Sri Lanka SEC watchful of stock bubble amid low ... - Reuters.com,1
1089,2019-07-10,207.179993,208.990005,205.649994,205.970001,185.96994,1779800,UPDATE 2-FTSE 100 wraps up worst year since 2008 financial crisis - Reuters.com,0
1090,2019-07-09,203.75,207.940002,203.539993,207.770004,187.595154,1812100,Bitcoin's Price History: Tracking The Volatile Rise Of The World's ... - Bankrate.com,0
1091,2019-07-08,206.360001,207.25,204.710007,205.75,185.771317,1853900,Best and Worst Performing U.S. Stocks in 2011 - Seeking Alpha,0
1092,2019-07-05,206.860001,208.759995,206.199997,207.899994,187.712524,1511400,"Market Report - Oct. 4, 2011 - CNNMoney - CNN.com",0
1093,2019-07-03,207.300003,207.399994,205.229996,206.039993,186.033127,978800,Carlyle mandates Goldman Sachs to sell stake in Turkey's Penti ... - Reuters.com,0
1094,2019-07-02,205.399994,206.309998,204.160004,205.979996,185.978973,1621400,Barclays Share price chart and calculator - Barclays,1
1095,2019-07-01,208.0,209.850006,205.740005,206.860001,186.773529,2465700,EMERGING MARKETS-Indonesia shares gain on rate cut hopes ... - Reuters.com,1
1096,2019-06-28,203.5,205.839996,202.940002,204.600006,184.732956,4854900,Goldman hikes 12-month gold price forecast to $2300 - Reuters.com,-1
1097,2019-06-27,197.570007,199.610001,196.759995,199.320007,179.965668,2239200,Japan pledges to cut plutonium stocks amid growing concern from ... - Reuters.com,-1
1098,2019-06-26,196.5,197.869995,196.119995,197.009995,177.879974,1649900,Last orders: Rise of closing auctions stirs worries in European stock ... - Reuters.com,-1
1099,2019-06-25,197.5,197.520004,194.009995,196.059998,177.022232,1828300,Shares in oilfield firm Weatherford International drop below $1 - Reuters.com,1
1100,2019-06-24,196.529999,199.350006,196.029999,197.490005,178.31337,2069800,Telehealth platform Amwell's shares surge 42% in NYSE debut - Reuters.com,1
1101,2019-06-21,195.339996,198.339996,193.970001,195.940002,176.913834,3365500,Carlyle-backed ZoomInfo's shares soar 90% in U.S. market debut - Reuters.com,0
1102,2019-06-20,197.5,198.190002,193.610001,195.699997,176.697174,2749300,Graphic: FTSE 100's changing face - A trip down memory lane - Reuters.com,0
1103,2019-06-19,195.350006,197.610001,194.789993,195.639999,176.643005,2196800,Graphic: FTSE 100's changing face - A trip down memory lane - Reuters.com,1
1104,2019-06-18,190.669998,197.130005,190.669998,194.979996,176.047089,2363000,"Tesla shares surge as investors embrace cash comments, Musk ... - Reuters.com",1
1105,2019-06-17,192.020004,193.229996,190.740005,190.830002,172.300049,1155600,"EMERGING MARKETS-Mozambique bond yields at record high, EM ... - Reuters.com",1
1106,2019-06-14,191.289993,192.169998,189.309998,191.660004,173.049469,1403900,"Chip equipment stocks surge after strong Lam Research, ASML results - Reuters.com",-1
1107,2019-06-13,190.410004,192.25,190.070007,191.449997,172.859863,1411400,Infosys shares extend losses as leadership issues outweigh share ... - Reuters.com,-1
1108,2019-06-12,193.610001,194.050003,189.830002,190.220001,171.749268,2059400,Asia Coffee-Vietnam prices fall on rising stockpile; Indonesia trade ... - Reuters.com,1
1109,2019-06-11,195.300003,196.119995,193.509995,194.729996,175.821335,1632200,Indonesia's first ever IPO by a startup draws robust investor interest - Reuters.com,0
1110,2019-06-10,191.399994,197.0,191.399994,194.119995,175.270615,2372000,BRIEF-Reg-Mueller Industries says declares special dividend on ... - Reuters.com,0
1111,2019-06-07,189.880005,190.610001,188.520004,189.809998,171.379074,1838600,America's money market industry: is it at risk? - Reuters.com,1
1112,2019-06-06,188.059998,190.740005,187.309998,189.809998,171.379074,1653500,Securitization boom exposes China's slapdash deleveraging efforts - Reuters.com,0
1113,2019-06-05,190.100006,190.160004,187.009995,188.440002,170.142151,1967800,The al Qaeda-inspired 28-year-old militant who launched London ... - Reuters.com,0
1114,2019-06-04,186.179993,189.990005,185.710007,189.880005,171.442291,2420800,Germany's confirmed coronavirus cases rise by 28438 - RKI - Reuters.com,0
1115,2019-06-03,181.699997,183.490005,180.729996,183.190002,165.401901,2857800,Kraft stock to switch to Nasdaq later this month - Reuters.com,0
1116,2019-05-31,184.770004,184.889999,182.309998,182.490005,164.769897,2640100,Biden plans to tap North Carolina official to lead U.S. environmental ... - Reuters.com,0
1117,2019-05-30,188.089996,189.369995,186.009995,187.369995,169.176025,1919300,BRIEF-Future Enterprises sells 9.02 pct of equity share capital of ... - Reuters.com,0
1118,2019-05-29,187.740005,188.649994,184.919998,188.050003,169.790009,2815800,E-commerce firm Infibeam eyes $334 mln valuation in sector's first IPO - Reuters.com,0
1119,2019-05-28,192.0,193.309998,189.389999,189.440002,170.277588,3040000,U.S. hits 16 million COVID cases even as vaccine begins roll-out - Reuters.com,0
1120,2019-05-24,192.889999,194.070007,191.679993,193.0,173.477432,1637200,HSS Hire Group prices IPO at bottom of range - Reuters.com,1
1121,2019-05-23,193.0,193.0,189.559998,191.970001,172.55162,3184100,"Tencent, Alibaba, Xiaomi units win Hong Kong online banking license - Reuters.com",0
1122,2019-05-22,197.440002,198.479996,195.460007,195.520004,175.742554,2427200,"Ethiopia sees war ending, EU complains of partisan aid access - Reuters.com",-1
1123,2019-05-21,198.660004,199.320007,198.0,199.110001,178.969421,2327600,HSBC loses senior European deal-makers as M&A ranking drops ... - Reuters.com,0
1124,2019-05-20,197.089996,197.779999,195.570007,197.240005,177.288589,2483400,Malaysia's Najib clueless about millions banked in his account ... - Reuters.com,0
1125,2019-05-17,196.300003,199.089996,196.300003,197.429993,177.459351,1928300,Factbox: Strait of Hormuz - the world's most important oil artery - Reuters.com,0
1126,2019-05-16,196.630005,200.0,196.619995,199.139999,178.996384,2008100,Britain's Prince Harry and Meghan Markle announce partnership ... - Reuters.com,0
1127,2019-05-15,194.639999,197.589996,193.419998,196.399994,176.533554,2271100,Buffett says wealthy Americans are 'definitely undertaxed' - Reuters.com,0
1128,2019-05-14,194.990005,198.130005,194.899994,196.279999,176.425674,2463300,Rio Tinto to develop bonded area operations for blending iron ore at ... - Reuters.com,0
1129,2019-05-13,197.899994,197.899994,194.0,194.970001,175.248199,3605600,China's Kashgar detects 137 new asymptomatic COVID cases - Reuters.com,1
1130,2019-05-10,200.979996,202.100006,198.990005,202.050003,181.612061,2089400,"Carbon dioxide levels grew at record pace in 2016, U.N. says - Reuters.com",0
1131,2019-05-09,199.509995,202.220001,197.910004,201.630005,181.234512,2333400,Seychelles preserves swathes of marine territory in debt-for-nature ... - Reuters.com,0
1132,2019-05-08,201.399994,203.199997,200.800003,200.949997,180.623291,1817600,Firebrand monk Wirathu travels to Myanmar's troubled Rakhine State - Reuters.com,0
1133,2019-05-07,203.339996,204.0,201.009995,202.630005,182.133301,2839500,Safilo to produce sunglasses made with recycled plastic from the ... - Reuters.com,0
1134,2019-05-06,202.800003,206.979996,201.710007,206.429993,185.54895,1927800,Iraq tourist sites still waiting for visitors - Reuters.com,0
1135,2019-05-03,206.009995,208.75,205.669998,207.520004,186.528717,1897600,"Displaced by mining, Peru villagers spurn shiny new town - Reuters.com",0
1136,2019-05-02,204.429993,206.220001,203.119995,204.990005,184.254654,1514700,BRIEF-Chinese nuclear group CGN buys part of Gaelectric's Irish ... - Reuters.com,0
1137,2019-05-01,206.399994,208.410004,204.029999,204.729996,184.02092,1981800,Top Iranian cleric Shahroudi dies - Reuters.com,0
1138,2019-04-30,206.940002,207.990005,204.149994,205.919998,185.090546,1833000,Rights lawyer Amal Clooney to represent Reuters reporters held in ... - Reuters.com,0
1139,2019-04-29,203.5,208.0,203.270004,206.919998,185.989395,2997000,BRIEF-Depomed reports second quarter 2016 financial results - Reuters.com,1
1140,2019-04-26,201.729996,203.119995,200.320007,203.080002,182.537827,1543100,Beijing may be starting to win its battle against smog - Reuters.com,0
1141,2019-04-25,199.699997,202.559998,199.100006,201.399994,181.027771,2075300,Ireland quietly comes to terms with dramatic change after abortion vote - Reuters.com,0
1142,2019-04-24,203.0,203.520004,199.729996,200.539993,180.254761,4606100,Bruising debate brings a reluctant Trump around on Afghanistan war - Reuters.com,0
1143,2019-04-23,204.25,205.190002,202.740005,204.139999,183.490601,2120900,Co-leader of Germany's far-right AfD to quit in major blow - Reuters.com,0
1144,2019-04-22,205.119995,205.589996,204.139999,204.600006,183.904068,1591400,UPDATE 3-France's Engie to shut Australia's dirtiest power plant - Reuters.com,0
1145,2019-04-18,207.089996,207.860001,205.149994,205.910004,185.081558,2874300,Swedish Match loses Norway court case on snus packaging - Reuters.com,0
1146,2019-04-17,201.960007,208.5,201.779999,207.899994,186.87027,4195300,Ukraine says Crimea visit by Bulgaria's Eurovision singer not illegal - Reuters.com,-1
1147,2019-04-16,199.619995,202.940002,199.240005,201.839996,181.423264,4852600,Islamic militant's death sparks eulogies in Malaysia - Reuters.com,0
1148,2019-04-15,204.110001,205.740005,199.699997,199.910004,179.688522,6617200,University of California task force won't support divesting fossil-fuel ... - Reuters.com,0
1149,2019-04-12,207.0,209.970001,206.369995,207.839996,186.816315,5096600,Troops from U.S.-led mission fight Taliban near Afghan city - Reuters.com,0
1150,2019-04-11,204.229996,205.449997,201.570007,202.830002,182.313126,2802100,"""goldman-sachs-stocks-2012"" - Google News",1
1151,2019-04-10,201.800003,203.169998,200.270004,202.979996,182.447968,1907100,European markets close higher despite geopolitical tensions; German economy contracts - CNBC,0
1152,2019-04-09,201.229996,201.589996,198.860001,200.619995,180.326675,2400900,Hiromi Yamaji: The banker turned stock exchange boss rattling ... - Financial Times,0
1153,2019-04-08,202.789993,203.630005,201.179993,202.539993,182.052444,1891500,"Ibotta Picks Goldman, Citi to Lead IPO at $2 Billion Valuation - Bloomberg",0
1154,2019-04-05,203.380005,205.5,202.059998,202.380005,181.908646,2447100,MercadoLibre (MELI) Q3 2023 Earnings Call Transcript - The Motley Fool,0
1155,2019-04-04,200.800003,204.289993,200.5,202.229996,181.773834,2582300,"OSB GROUP PLC - Directorate change -November 02, 2023 at 03 ... - Marketscreener.com",0
1156,2019-04-03,199.25,201.089996,198.539993,200.860001,180.542419,3227900,Moving Averages: S&P Finishes October Down 2.2% - dshort - Advisor Perspectives,0
1157,2019-04-02,196.240005,197.759995,195.399994,197.5,177.522247,2247000,Phillips 66 (PSX) Q3 2023 Earnings Call Transcript - The Motley Fool,0
1158,2019-04-01,194.0,198.089996,193.610001,196.740005,176.839127,3562600,"Israel-Hamas War's Economic Shock; Turkey Rates, Egypt Pound ... - Bloomberg",1
1159,2019-03-29,192.679993,193.110001,191.139999,191.990005,172.569626,2632800,"Earnings call: Aflac reports solid Q3 2023 results, announces COO ... - Investing.com",0
1160,2019-03-28,190.740005,191.910004,189.289993,191.179993,171.841537,2343400,"SITC 2023 : Preclinical development of LYL119, a ROR1-targeted ... - Marketscreener.com",0
1161,2019-03-27,190.600006,191.610001,188.740005,190.029999,170.807892,2343800,Earnings call: Cummins Inc. Reports Q3 2023 Financial Results ... - Investing.com,1
