,Date,Open,High,Low,Close,Adj Close,Volume,news,sentiment_Analysis
1665,2017-03-24,233.0,233.699997,226.970001,228.410004,199.71286,6387300,Goldman's $285 Million Package for Gary Cohn Is Questioned ... - The New York Times,1
1666,2017-03-23,230.75,234.630005,229.949997,231.899994,202.76442,4770700,Chinese mainland capital to Hong Kong stock market will soar in ... - China Daily,1
1667,2017-03-22,231.220001,232.919998,229.160004,231.070007,202.038696,6291300,"Self-driving cars could cost America's professional drivers up to 25,000 jobs a month, Goldman Sachs says - CNBC",0
1668,2017-03-21,243.309998,243.309998,232.789993,233.0,203.726227,5660900,History says there's a 99% chance stock market returns will be ... - CNBC,0
1669,2017-03-20,243.320007,244.929993,241.520004,242.139999,211.717896,2759100,Is Apple Inc. (AAPL) Stock Really Worth $150? - U.S News & World Report Money,0
1670,2017-03-17,249.679993,249.679993,243.860001,243.940002,213.291718,5438100,Will 2018 Bring a Goldman Sachs Stock Split? - The Motley Fool,-1
1671,2017-03-16,247.850006,250.199997,247.309998,248.220001,217.033997,2940600,Goldman Sachs made a staggering $200 million in one day as markets plunged - CNBC,0
1672,2017-03-15,248.350006,250.279999,245.559998,246.779999,215.774918,3427000,Global Market Cap Is About to Hit $100 Trillion - Goldman Sachs ... - Business Insider,0
1673,2017-03-14,246.809998,247.830002,245.410004,247.720001,216.596786,2144200,"Stock market news, Wednesday, July 19, 2017 - Business Insider",0
1674,2017-03-13,249.320007,249.320007,247.210007,248.160004,216.981552,1801100,Goldman Sachs tells investors to consider new space age - CNBC,0
1675,2017-03-10,251.839996,251.899994,246.869995,248.380005,217.173889,3365900,Goldman Sachs says these 14 VIP stocks matter most to hedge funds - Business Insider,0
1676,2017-03-09,251.220001,252.740005,249.520004,250.179993,218.747742,3061500,Dow sheds 370 points; stocks close lower and wipe out monthly gains on Trump fears - CNBC,0
1677,2017-03-08,253.619995,254.770004,249.610001,250.240005,218.800186,3574400,FAAMG Stocks: Acronym for American Tech Stocks - Investopedia,0
1678,2017-03-07,252.490005,253.0,250.309998,250.899994,219.377319,2497300,"Stock Market News for January 19, 2017 - Yahoo Finance",-1
1679,2017-03-06,252.169998,252.729996,250.5,252.009995,220.347794,2467000,GOLDMAN SACHS: This negative stock market signal is 'greatly exaggerated' - Business Insider,1
1680,2017-03-03,251.059998,254.75,251.059998,252.889999,221.117233,3163700,Goldman Sachs sharpe ratio based stock picks - Business Insider,0
1681,2017-03-02,253.520004,254.240005,250.970001,251.059998,219.517136,3020000,Redfin IPO: RDFN stock opening trade - CNBC,0
1682,2017-03-01,253.710007,255.149994,251.259995,252.710007,220.959869,5218300,Goldman Sachs warns of markets that are the most expensive since 1900 - Business Insider,0
1683,2017-02-28,248.0,249.0,245.610001,248.059998,216.894135,3627100,Warren Buffett just made a quick $12 billion on a clever Bank of America investment - CNBC,0
1684,2017-02-27,247.210007,249.759995,246.610001,249.330002,217.436157,2372600,"Stock market news, Closing Bell October 4, 2017 - Business Insider",0
1685,2017-02-24,247.699997,248.880005,246.100006,247.350006,215.709488,3565400,"A material stock market correction is not in place, Goldman says - Business Insider",0
1686,2017-02-23,251.309998,251.899994,249.320007,251.190002,219.058228,2594700,Morgan Stanley and Goldman Sachs should ‘hang heads in shame’ over Snap IPO: Analyst - CNBC,0
1687,2017-02-22,250.059998,252.350006,250.0,251.729996,219.529205,2378800,"Companies are ramping up share buybacks, and they're increasingly using debt to do so - CNBC",0
1688,2017-02-21,251.0,252.649994,250.710007,251.759995,219.555374,2794900,"The markets story of 2017 — fake news, real returns - Yahoo Finance",1
1689,2017-02-17,247.509995,250.559998,247.110001,250.380005,218.351898,3262300,Goldman Sachs CEO Blankfein received a $2 million pay bump in 2017 - CNBC,-1
1690,2017-02-16,250.300003,250.779999,248.440002,249.440002,217.532104,2286300,"Stitch Fix shares retreat after IPO pop, close at $15.15 - CNBC",0
1691,2017-02-15,250.580002,251.949997,248.509995,250.539993,218.491394,4296600,Stock pros: Own these stocks in 2017 - USA TODAY,0
1692,2017-02-14,246.009995,250.0,245.690002,249.460007,217.549576,4141500,Wall Street analysts at war with traders over bank stocks - Business Insider,0
1693,2017-02-13,244.490005,247.479996,244.490005,246.270004,214.767624,2998200,"FANG Stocks: Definition, Companies, Performance, and How to Invest - Investopedia",0
1694,2017-02-10,243.369995,244.160004,241.229996,242.720001,211.671722,3072800,Dole Food Had Too Many Shares - Bloomberg,0
1695,2017-02-09,237.729996,243.289993,237.419998,241.550003,210.651382,3550800,"30 Under 30 Finance 2017: The Top Young Traders, Bankers And Dealmakers - Forbes",0
1696,2017-02-08,238.300003,238.940002,236.309998,237.729996,207.320023,2744700,Barclays Share price chart and calculator - Barclays,-1
1697,2017-02-07,241.149994,241.440002,239.389999,239.619995,208.968262,2660200,Infosys shares extend losses as leadership issues outweigh share ... - Reuters.com,0
1698,2017-02-06,239.600006,243.649994,239.169998,239.979996,209.282211,4639200,Carlyle mandates Goldman Sachs to sell stake in Turkey's Penti ... - Reuters.com,0
1699,2017-02-03,234.520004,241.110001,234.199997,240.949997,210.128128,7381000,"Stock Market News For August 08, 2017 - Zacks Investment Research",0
1700,2017-02-02,228.509995,232.330002,227.050003,230.410004,200.936417,2775700,BRIEF-Reg-Mueller Industries says declares special dividend on ... - Reuters.com,0
1701,2017-02-01,230.509995,232.860001,229.520004,230.669998,201.163147,4024500,MOVES-BlackRock hires private equity specialists from Goldman ... - Reuters.com,0
1702,2017-01-31,232.850006,234.350006,228.160004,229.320007,199.985794,5156400,Bitcoin's Price History: Tracking The Volatile Rise Of The World's ... - Bankrate.com,1
1703,2017-01-30,235.580002,236.289993,231.520004,233.899994,203.97995,3803300,UPDATE 2-FTSE 100 wraps up worst year since 2008 financial crisis - Reuters.com,-1
1704,2017-01-27,236.899994,237.970001,236.009995,236.949997,206.639801,3253100,Last orders: Rise of closing auctions stirs worries in European stock ... - Reuters.com,0
1705,2017-01-26,237.470001,240.789993,237.470001,239.580002,208.933395,4195600,"Goldman Sachs streamlines asset, consumer, wealth management ... - Reuters.com",0
1706,2017-01-25,235.529999,237.330002,234.490005,237.25,206.901474,3716800,"Corporate Buybacks Happen at Record Pace, Goldman Sachs ... - Business Insider",1
1707,2017-01-24,231.860001,236.059998,230.839996,233.679993,203.788116,4448200,"Tesla shares surge as investors embrace cash comments, Musk ... - Reuters.com",1
1708,2017-01-23,231.860001,233.75,230.75,232.669998,202.907318,3136200,"After profit beat, GM looks to trucks, SUVs to rev up margins - Reuters.com",-1
1709,2017-01-20,231.619995,233.229996,230.539993,232.199997,202.497421,5211800,Japan pledges to cut plutonium stocks amid growing concern from ... - Reuters.com,1
1710,2017-01-19,234.070007,234.75,230.619995,231.410004,201.808487,4561800,Barclays earnings show it has the fastest growing stock-trading team on earth - Business Insider,1
1711,2017-01-18,236.0,237.690002,231.520004,234.289993,204.320084,7590500,Telehealth platform Amwell's shares surge 42% in NYSE debut - Reuters.com,0
1712,2017-01-17,242.940002,243.059998,235.610001,235.740005,205.584579,6277200,Graphic: FTSE 100's changing face - A trip down memory lane - Reuters.com,1
1713,2017-01-13,245.429993,247.770004,242.910004,244.300003,213.049637,4186100,Indonesia's first ever IPO by a startup draws robust investor interest - Reuters.com,0
1714,2017-01-12,245.059998,245.470001,241.570007,243.839996,212.648453,4022300,INTERVIEW-Sri Lanka SEC watchful of stock bubble amid low ... - Reuters.com,0
1715,2017-01-11,242.770004,245.839996,242.0,245.759995,214.322861,3532600,Germany's confirmed coronavirus cases rise by 28438 - RKI - Reuters.com,0
1716,2017-01-10,240.869995,243.440002,239.050003,242.570007,211.540909,3432900,Biden plans to tap North Carolina official to lead U.S. environmental ... - Reuters.com,0
1717,2017-01-09,243.25,244.690002,241.470001,242.889999,211.819977,3022800,Kraft stock to switch to Nasdaq later this month - Reuters.com,0
1718,2017-01-06,242.289993,246.199997,241.369995,244.899994,213.572861,3591100,The al Qaeda-inspired 28-year-old militant who launched London ... - Reuters.com,-1
1719,2017-01-05,242.720001,243.229996,236.779999,241.320007,210.45079,3562600,British-Australian 7-year-old among dead in Barcelona attack - Reuters.com,0
1720,2017-01-04,241.440002,243.320007,240.029999,243.130005,212.029282,2728700,U.S. hits 16 million COVID cases even as vaccine begins roll-out - Reuters.com,0
1721,2017-01-03,242.699997,244.970001,237.970001,241.570007,210.668823,4384200,UK PM Johnson wishes France's Macron a speedy recovery from ... - Reuters.com,0
1722,2016-12-30,238.509995,240.5,237.399994,239.449997,208.820038,2355500,"John Whitehead, former leader of Goldman Sachs, dies at 92 - Reuters.com",0
1723,2016-12-29,240.75,241.070007,236.639999,238.179993,207.712463,2619000,Firebrand monk Wirathu travels to Myanmar's troubled Rakhine State - Reuters.com,0
1724,2016-12-28,243.690002,244.5,240.440002,240.649994,209.866501,3053000,UPDATE 3-France's Engie to shut Australia's dirtiest power plant - Reuters.com,0
1725,2016-12-27,241.949997,242.589996,240.399994,241.559998,210.660126,1998200,"""goldman-sachs-stocks-2018"" - Google News",0
1726,2016-12-23,239.539993,241.899994,238.910004,240.970001,210.145615,2187500,Goldman Sachs Asset Management launches new defined outcome ... - Reuters.com,0
1727,2016-12-22,241.229996,242.860001,239.550003,240.119995,209.404312,2636500,Transaction in Own Shares - Yahoo Finance,0
1728,2016-12-21,242.240005,242.399994,240.080002,241.440002,210.555466,3277800,Will Goldman Sachs's big bet on wealth management work? - Financial Times,1
1729,2016-12-20,240.520004,243.649994,240.229996,243.089996,211.994385,4487700,"Big Yields, Little Stocks: 5 Small-Caps Paying up to 14.7% - Nasdaq",0
1730,2016-12-19,238.339996,239.740005,236.259995,239.070007,208.488647,3743300,How Not To Invest Stupid And Other Smart Money Lessons From A ... - Forbes,0
1731,2016-12-16,242.800003,243.190002,238.399994,238.899994,208.340378,6876400,7 Reasons to Avoid Goldman Sachs (GS) Without Hesitation - 24/7 Wall St.,0
1732,2016-12-15,242.490005,245.570007,241.619995,243.0,211.915924,4829700,Is Microsoft About to Overtake Apple as the World's Most Valuable ... - The Motley Fool,0
1733,2016-12-14,235.669998,243.119995,235.369995,239.929993,209.238647,6172400,2022 Annual Report - Goldman Sachs,0
1734,2016-12-13,239.0,240.179993,235.509995,238.550003,208.035141,4680500,Form 424B2 UBS AG - StreetInsider.com,0
1735,2016-12-12,240.5,242.830002,236.369995,237.169998,206.831665,5022000,Goldman Sachs CEO Solomon Responds to Critics and Makes His ... - Barron's,-1
1736,2016-12-09,240.610001,242.0,238.880005,241.850006,210.91301,5456000,Goldman Sachs fined $3 mln by FINRA over mismarking short sale ... - Reuters.com,1
1737,2016-12-08,236.880005,242.419998,236.0,241.449997,210.564163,7343700,Goldman Sachs sees room for investors to grow more bullish on US ... - Reuters.com,0
1738,2016-12-07,230.399994,236.089996,230.399994,235.559998,205.427597,6595200,US Stocks are Forecast to Have Less Pain but No Gain in 2023 - Goldman Sachs,0
1739,2016-12-06,230.179993,232.669998,227.899994,231.380005,201.782303,5259300,"Goldman's C.E.O. Is Stuck, Without a Clear Lifeline - The New York Times",0
1740,2016-12-05,225.520004,229.199997,225.240005,228.550003,199.314316,4599300,How the Wealthy Sidestep “Wash Sale” Ban to Reap Tax Savings - ProPublica,0
1741,2016-12-02,226.0,226.25,221.220001,223.360001,194.788223,5297400,Whatever Happened to Amazon's Drone Delivery Service? - Slashdot,0
1742,2016-12-01,220.929993,227.160004,220.350006,226.630005,197.639969,7606500,Former Goldman Sachs Investment Banker Sentenced in $2.7B ... - Department of Justice,-1
1743,2016-11-30,215.199997,220.770004,214.970001,219.289993,191.238815,6507900,"Why Goldman's consumer ambitions failed, and what it means for CEO David Solomon - CNBC",-1
1744,2016-11-29,209.990005,212.919998,209.919998,211.75,184.663315,2577600,Adyen shares hit more than three-year low after 'apocalypse' selling - Reuters.com,0
1745,2016-11-28,210.0,211.759995,209.600006,210.350006,182.875595,3297400,Goldman Sachs Stock Sinks After Earnings Fall Short - The New York Times,1
1746,2016-11-25,211.360001,212.75,211.0,211.380005,183.771057,1974000,Goldman Sachs says jobs mismatch drove up China's youth unemployment - CNBC,0
1747,2016-11-23,211.5,213.410004,209.369995,212.309998,184.579544,3717400,What Is Volmageddon? Why Record Options Trading Could Risk Another 20% Stock Crash - Forbes,0
1748,2016-11-22,211.360001,211.949997,209.889999,211.110001,183.536331,2945700,"Goldman Sachs dismisses AI bubble, predicts upcoming revolution - Cointelegraph",1
1749,2016-11-21,211.460007,211.690002,209.179993,211.080002,183.510239,2860200,Goldman Sachs predicts stocks will rally 11% in 2018 - Yahoo Finance,0
1750,2016-11-18,209.869995,212.070007,209.720001,210.350006,182.875595,4278200,SEC charges Goldman Sachs Asset Management with not following ... - Reuters.com,0
1751,2016-11-17,206.259995,209.690002,205.669998,209.630005,182.249649,3572400,Financials - Goldman Sachs,0
1752,2016-11-16,207.350006,208.080002,204.830002,206.259995,179.319733,5276200,Will 2018 Bring a Goldman Sachs Stock Split? - The Motley Fool,0
1753,2016-11-15,206.559998,211.199997,205.169998,211.190002,183.605835,4893800,Goldman Sachs' Stock May Drop 9% - Investopedia,1
1754,2016-11-14,204.149994,211.770004,204.149994,209.179993,181.858398,8248100,Goldman Sachs: A market rebound is coming driven by company share buybacks - CNBC,0
1755,2016-11-11,198.25,205.0,198.25,203.940002,177.302795,6290200,Goldman Sachs shares just did something they've never done before - CNBC,0
1756,2016-11-10,194.529999,204.669998,194.0,200.869995,174.633743,11345400,Goldman Sachs Stock in Trading Range Ahead of Earnings - Investopedia,0
1757,2016-11-09,185.0,193.539993,183.449997,192.630005,167.470032,7823800,"Bed Bath & Beyond stock is worth $2 per share, Goldman Sachs says - Yahoo Finance",0
1758,2016-11-08,180.110001,182.679993,178.460007,181.919998,158.158905,2646200,Goldman: Government-directed traders bought up billions in Chinese stocks last quarter - CNBC,0
1759,2016-11-07,179.0,181.5,179.0,181.479996,157.776367,3338800,"Elon Musk sold nearly $7 billion worth of Tesla stock—here’s how much money you’d have if you’d invested $1,000 in the company 10 years ago - CNBC",-1
1760,2016-11-04,176.330002,177.339996,174.729996,175.919998,152.942581,1846500,Goldman Sachs made a staggering $200 million in one day as markets plunged - CNBC,1
1761,2016-11-03,176.770004,177.970001,176.210007,176.210007,153.194733,1972700,"The stock market is on pace to hit another, more impactful trillion-dollar milestone - Yahoo Finance",1
1762,2016-11-02,177.070007,177.5,176.070007,176.580002,153.516388,2104800,Goldman Sachs expects gold to 'outperform' amid growing fears of a ... - CNBC,0
1763,2016-11-01,179.0,179.179993,176.610001,178.059998,154.80307,2900600,Intelligence - Technology Driving Innovation - Goldman Sachs,0
1764,2016-10-31,177.679993,178.5,177.229996,178.240005,154.959534,1828200,Goldman Sachs lifts CEO Solomon's pay to $35 million - Reuters.com,0
1765,2016-10-28,178.509995,178.509995,175.460007,177.139999,154.00325,2042800,Warren Buffett Invested $5B in Goldman During the 2008 Crisis. What’s It Worth Now? - Yahoo Finance,0
1766,2016-10-27,178.190002,178.850006,176.570007,177.75,154.5336,3021900,Goldman could withhold some 2018 pay for top executives over Malaysia scandal - CNBC,0
1767,2016-10-26,174.789993,177.899994,173.929993,177.070007,153.942398,2533800,"Stock Market Outlook: Expect Lower Returns, Goldman CEO ... - Markets Insider",0
1768,2016-10-25,175.039993,175.960007,174.639999,175.550003,152.620926,2423300,New Goldman Sachs Fund Will Track Paul Tudor Jones's Feel-Good ... - The New York Times,-1
1769,2016-10-24,175.5,175.789993,174.350006,175.119995,152.247055,1943200,"Goldman downgrades Walgreens' stock to rare 'sell,' shares fall - CNBC",0
1770,2016-10-21,172.839996,174.899994,172.509995,174.669998,151.855835,2004400,Average Stock Market Return Over the Past 10 Years - Business Insider,0
1771,2016-10-20,174.0,175.789993,173.800003,174.509995,151.716721,2471100,Corporate America is spending more on buybacks than anything else - CNN.com,0
1772,2016-10-19,173.369995,175.679993,173.179993,174.509995,151.716721,3676000,How tweets by Tesla's Elon Musk have moved markets - Reuters.com,1
1773,2016-10-18,172.009995,173.470001,171.100006,172.630005,150.08226,4482500,"Goldman recommends buying Ford stock, forecasts $12 price - Detroit Free Press",0
1774,2016-10-17,170.5,171.270004,168.449997,169.0,146.926407,3061400,Here's how long stock market corrections last and how bad they can get - CNBC,0
1775,2016-10-14,171.600006,172.949997,169.110001,170.520004,148.247879,5282300,Is Goldman Sachs a Buy? - The Motley Fool,0
1776,2016-10-13,167.600006,167.630005,165.509995,167.419998,145.552826,2713700,How Much Could the 1MDB Scandal Cost Goldman Sachs ... - The New York Times,0
1777,2016-10-12,169.039993,169.990005,168.300003,169.300003,147.18721,2404000,A Top Goldman Banker Raised Ethics Concerns. Then He Was ... - The New York Times,0
1778,2016-10-11,169.839996,170.869995,167.910004,169.039993,146.961212,2680000,12 Growth Stocks That Will Win Long Term: Goldman - Investopedia,0
1779,2016-10-10,170.520004,171.75,170.100006,171.039993,148.699982,2532000,Goldman Sachs-backed start-up Circle introducing a crypto version of the US dollar - CNBC,0
1780,2016-10-07,167.5,169.979996,166.240005,169.830002,147.648041,3390200,Goldman Sachs Once Looked Invincible. Now It's Losing Money ... - The New York Times,0
1781,2016-10-06,167.179993,167.289993,164.820007,167.149994,145.318085,2858000,The richest 1% own 50% of stocks held by American households - Yahoo Finance,0
1782,2016-10-05,163.320007,166.570007,163.009995,166.399994,144.666016,2548200,Stock Market Rebound: Goldman Sachs Outlines One Lingering ... - Business Insider,0
1783,2016-10-04,161.240005,164.149994,161.229996,162.270004,141.07547,2469900,9 Stocks That Can Outperform As Bull Market Ages: Goldman - Investopedia,0
1784,2016-10-03,160.5,161.720001,160.25,161.070007,140.032211,2444700,CEO berates analysts on conference call: 'You are a disaster...they will have to commit suicide' - CNBC,1
1785,2016-09-30,159.949997,162.410004,157.800003,161.270004,140.206055,4497200,"With wages on the rise, Goldman Sachs has a 'low labor costs' stock strategy that beats the market - CNBC",0
1786,2016-09-29,163.380005,163.960007,157.770004,158.949997,138.189056,3733800,Dow dives 400 points to end its worst week in 10 years - CNBC,0
1787,2016-09-28,163.339996,163.789993,161.679993,163.449997,142.101318,1678100,12 Stocks To Buy For Market's Upturn: Goldman Sachs - Investopedia,0
1788,2016-09-27,160.720001,163.449997,159.820007,162.889999,141.614441,2602700,"S&P 500 drops more than 2% to new low for 2018, Dow dives 500 points - CNBC",0
1789,2016-09-26,163.830002,163.970001,161.0,161.479996,140.388657,2772200,What Happened With Apple Stock in 2018 and What's Next - Barrons - Barron's,0
1790,2016-09-23,167.75,168.100006,165.050003,165.130005,143.56189,3421200,Johnson & Johnson Stock Had a Baby Powder Problem in 2018 - Barron's,0
1791,2016-09-22,168.449997,169.330002,167.699997,168.020004,146.074463,2467700,"Goldman warns that Apple is too dependent on Google for services revenue, and will need to roll out a 'Prime' bundle - CNBC",0
1792,2016-09-21,167.419998,168.279999,165.929993,167.029999,145.213776,2333600,McDonald’s Stock Was a Winner in 2018 - Barron's,0
1793,2016-09-20,167.679993,168.279999,166.389999,166.470001,144.726868,1532900,Notable Investments by Goldman Sachs - Investopedia,0
1794,2016-09-19,167.339996,168.309998,165.679993,166.210007,144.50087,2030700,"Corporate Buybacks Happen at Record Pace, Goldman Sachs ... - Business Insider",0
1795,2016-09-16,167.850006,168.050003,165.610001,166.0,144.318298,4534900,My top 10 stocks for 2018 - CNBC,1
1796,2016-09-15,165.779999,168.759995,165.759995,168.080002,146.126602,1645200,"Dow rebounds on strong profits from Goldman Sachs, Johnson ... - USA TODAY",0
1797,2016-09-14,167.0,167.860001,165.589996,166.160004,144.457367,1995900,Tesla is the biggest short in the US stock market - CNBC,1
1798,2016-09-13,168.539993,169.970001,166.380005,167.0,145.187592,2788200,How Ant Financial grew larger than Goldman Sachs - CNBC,0
1799,2016-09-12,167.009995,171.669998,166.229996,171.059998,148.717361,2647900,Home Depot Stock Hammered in 2018 - Barron's,1
1800,2016-09-09,170.830002,172.419998,168.509995,168.570007,146.552612,3411800,"Dow plunges more than 500 points, erases gain for 2018 - CNBC",1
1801,2016-09-08,169.350006,171.880005,168.710007,171.660004,149.238998,3031600,Spotify closes up 13 percent after falling from highs on first day of trading - CNBC,0
1802,2016-09-07,168.699997,170.210007,168.649994,169.669998,147.508911,1584300,Stocks Rise on Wall Street Even as Trade Fight Between U.S. and ... - The New York Times,0
1803,2016-09-06,168.720001,169.789993,167.470001,169.330002,147.213348,2034900,Tumultuous Week on Wall Street Ends With a Small Rally ... - The New York Times,0
1804,2016-09-02,168.520004,169.740005,167.899994,169.179993,147.082947,1747500,Goldman Sachs Earnings Unlikely to End Downtrend - Investopedia,0
1805,2016-09-01,170.0,170.070007,166.660004,168.509995,146.500412,2843300,Warren Buffett explains the enduring power of stock buybacks for long-term investors - CNBC,1
1806,2016-08-31,169.25,170.240005,167.470001,169.460007,147.326355,3688200,US STOCKS-Futures slip after strong Wall St rally as Biden edges ... - Reuters.com,0
1807,2016-08-30,166.220001,169.509995,166.220001,169.369995,147.248062,2934100,"Stock Market News For July 17, 2018 - Nasdaq",0
1808,2016-08-29,166.600006,167.860001,166.149994,166.869995,144.509537,2620900,Goldman partner left after making ethics complaint - Financial Times,0
1809,2016-08-26,166.759995,168.070007,165.360001,165.970001,143.730118,2402200,The Best Performing Stocks Of 2018 - Seeking Alpha,0
1810,2016-08-25,165.080002,166.039993,164.610001,165.899994,143.669525,1441400,How Warren Buffett Decides It's Time to Sell a Stock - The Motley Fool,1
1811,2016-08-24,165.779999,166.699997,164.850006,165.300003,143.149902,2035300,World Cup 2018: Goldman Sachs predicts Brazil will get revenge against Germany - CNBC,0
1812,2016-08-23,167.0,167.850006,165.979996,166.080002,143.825409,1965500,Goldman Sachs new partner class list 2018 - Business Insider,0
1813,2016-08-22,166.0,166.910004,164.889999,166.259995,143.981216,1448100,Barclays Share price chart and calculator - Barclays,0
1814,2016-08-19,165.360001,166.899994,164.5,166.229996,143.955307,1840900,Going to Cash Was Best Performing Asset of 2018. Here's How to Do It - Markets Insider,0
1815,2016-08-18,165.339996,166.559998,164.630005,166.059998,143.808105,1750500,FAANG Stocks: Definition and Companies Involved - Investopedia,0
1816,2016-08-17,165.940002,166.320007,164.740005,165.669998,143.470322,2061700,Goldman Sachs's Ex-CEO Lloyd Blankfein Met Malaysian at Center ... - The Wall Street Journal,-1
1817,2016-08-16,164.990005,166.759995,164.720001,165.649994,143.453003,2523800,Shares in oilfield firm Weatherford International drop below $1 - Reuters.com,0
1818,2016-08-15,163.869995,165.839996,163.800003,165.550003,143.366394,2222200,"FANG Stocks: Definition, Companies, Performance, and How to Invest - Investopedia",1
1819,2016-08-12,162.669998,163.369995,162.070007,163.25,141.374588,1440800,Barclays earnings show it has the fastest growing stock-trading team on earth - Business Insider,-1
1820,2016-08-11,162.199997,164.25,161.929993,163.860001,141.902893,1827700,"Goldman Sachs reports first loss since 2008 - Oct. 18, 2011 - CNN.com",0
1821,2016-08-10,163.449997,163.600006,162.009995,162.190002,140.456635,1656100,Correction Definition - Investopedia,0
1822,2016-08-09,162.5,164.580002,162.5,163.440002,141.539139,1957400,Too Big to Fail Banks: Where Are They Now? - Investopedia,1
1823,2016-08-08,162.100006,163.979996,162.009995,162.830002,141.010834,2266600,UPDATE 2-FTSE 100 wraps up worst year since 2008 financial crisis - Reuters.com,0
1824,2016-08-05,159.75,162.130005,159.199997,162.089996,140.370026,2676100,Carlyle mandates Goldman Sachs to sell stake in Turkey's Penti ... - Reuters.com,1
1825,2016-08-04,158.220001,158.899994,157.410004,158.050003,136.871399,2005700,"Tesla shares surge as investors embrace cash comments, Musk ... - Reuters.com",0
1826,2016-08-03,156.449997,158.949997,156.179993,158.339996,137.122574,2284700,"""goldman-sachs-stocks-2019"" - Google News",1
1827,2016-08-02,157.649994,158.460007,155.369995,156.059998,135.148071,3182800,Boeing shares higher as Goldman Sachs adds planemaker to ... - TheStreet,0
1828,2016-08-01,158.809998,159.919998,157.929993,158.179993,136.983978,2316300,"Markets News, Nov. 3, 2023: Stocks Gain to Cap Best Week of 2023 ... - Investopedia",0
1829,2016-07-29,159.509995,160.190002,158.649994,158.809998,137.529587,2388200,Will Goldman Sachs's big bet on wealth management work? - Financial Times,1
1830,2016-07-28,160.179993,160.960007,158.839996,160.529999,139.019089,2047400,"Big Yields, Little Stocks: 5 Small-Caps Paying up to 14.7% - Nasdaq",0
1831,2016-07-27,161.199997,162.169998,160.410004,160.990005,139.417419,2317200,Transaction in Own Shares - Yahoo Finance,0
1832,2016-07-26,160.679993,161.5,159.419998,161.160004,139.564682,2150100,"Goldman Sachs to promote 608 to managing directors, down from ... - Marketscreener.com",0
