,Date,Open,High,Low,Close,Adj Close,Volume,news,sentiment_Analysis
1663,2017-03-28,87.019997,89.019997,86.980003,88.599998,73.168953,16264400,JPMorgan Chase Targets More Than $2.5 Trillion over 10 Years to ... - JPMorgan Chase,0
1664,2017-03-27,85.529999,87.400002,85.230003,87.239998,72.04583,16689300,JPMorgan to pay $920 million for manipulating precious metals ... - Reuters,0
1665,2017-03-24,87.790001,88.089996,86.769997,87.290001,72.087105,16093200,J.P. Morgan India | About us - JP Morgan,0
1666,2017-03-23,87.209999,88.5,87.089996,87.389999,72.169678,16090100,JPMorgan Chase Resolves Investigations Into Precious Metals and ... - JPMorgan Chase,0
1667,2017-03-22,86.889999,88.07,86.010002,87.529999,72.285309,21741000,JPMorgan Chase Announces 2017 Investor Day - JPMorgan Chase,0
1668,2017-03-21,90.360001,90.639999,87.059998,87.389999,72.169678,33089200,Bank of America vs. Wells Fargo vs. JPMorgan Chase: Which ... - The Motley Fool,0
1669,2017-03-20,90.269997,91.169998,89.790001,90.029999,74.349892,14623600,JPMorgan Chase (JPM) Testing 2020's All-Time High - Investopedia,0
1670,2017-03-17,91.830002,92.040001,90.650002,90.68,74.886681,21734700,J.P. Morgan Australia & New Zealand | About us - JP Morgan,0
1671,2017-03-16,92.029999,92.809998,91.57,91.639999,75.679474,14492000,Billionaire Stephen Deckoff buys Jeffrey Epstein's private islands - CNBC,-1
1672,2017-03-15,91.800003,92.550003,91.129997,91.730003,75.753799,16601400,"Why Goldman's consumer ambitions failed, and what it means for CEO David Solomon - CNBC",0
1673,2017-03-14,91.019997,91.650002,90.769997,91.510002,75.572105,10237700,JPMorgan Stock in Rally Mode Despite Weak Quarter - Investopedia,0
1674,2017-03-13,91.309998,91.779999,90.93,91.360001,75.448257,10004300,JPMorgan Chase to Pay $264 Million to Settle Foreign Bribery Case ... - The New York Times,0
1675,2017-03-10,91.949997,92.0,90.529999,91.279999,75.382187,13729900,JPMorgan Chase (JPM) Trading Lower After Buffett Sale - Investopedia,0
1676,2017-03-09,91.599998,92.139999,91.150002,91.57,75.621666,13726200,JPMorgan Chase Earnings: What to Look For - Investopedia,0
1677,2017-03-08,92.68,92.849998,91.099998,91.209999,75.324387,17378400,J.P. Morgan Saudi Arabia | About us - JP Morgan,0
1678,2017-03-07,91.639999,92.089996,91.209999,91.410004,75.489525,11156800,Expertise for Substantial Wealth - JP Morgan,0
1679,2017-03-06,92.25,92.32,91.099998,91.919998,75.910721,15059200,"Citigroup, Wells Fargo and JPMorgan Climb. Is It Time To Buy Bank ... - Kiplinger's Personal Finance",0
1680,2017-03-03,92.139999,93.110001,92.139999,92.800003,76.637444,12817500,Bank of America vs. JPMorgan Chase: Who Has the Better Deposit ... - The Motley Fool,0
1681,2017-03-02,93.870003,93.919998,92.029999,92.139999,76.092384,16862500,Is JPMorgan Chase Stock Cheap or Expensive? - Yahoo Finance,0
1682,2017-03-01,92.790001,93.980003,92.610001,93.599998,77.298111,24451400,JPMorgan (JPM) Breaks Out to All-Time High - Investopedia,0
1683,2017-02-28,89.849998,90.82,89.589996,90.620003,74.837143,15183500,JPMorgan Chase Names Reggie Chambers the New Head of ... - JPMorgan Chase,0
1684,2017-02-27,90.32,90.730003,90.019997,90.43,74.680222,12361000,JPMorgan Chase Is 10 Times Bigger Than You Think It Is - The Motley Fool,0
1685,2017-02-24,90.18,90.540001,89.730003,90.330002,74.597633,15062300,Top JPMorgan Chase Shareholders - Investopedia,0
1686,2017-02-23,91.18,91.339996,90.519997,91.129997,75.258316,11067000,"Jamie Dimon's Compensation at JPMorgan Chase Rises 35%, to ... - The New York Times",0
1687,2017-02-22,90.519997,91.300003,90.419998,91.059998,75.200485,11839000,Warren Buffett sells JPMorgan Chase stock and buys Verizon - CNN,0
1688,2017-02-21,90.510002,91.150002,90.459999,91.010002,75.159225,14068300,Is The Top Bank Stock A Buy After Reclaiming This Support Level? - Investor's Business Daily,0
1689,2017-02-17,89.82,90.470001,89.690002,90.230003,74.515053,15776600,Cargo ship owned by JPMorgan Chase seized by US with 20 tons of cocaine - CNN,0
1690,2017-02-16,90.400002,91.040001,89.769997,90.529999,74.76281,17672700,J.P. Morgan Germany | About us - JP Morgan,0
1691,2017-02-15,90.080002,90.870003,89.349998,90.589996,74.812355,17381800,J.P. Morgan Peru | About us - JP Morgan,0
1692,2017-02-14,88.300003,89.699997,88.110001,89.559998,73.961739,17932100,"JP Morgan to unveil new investing app with an eye-catching, disruptive price: Free - CNBC",0
1693,2017-02-13,87.440002,88.739998,87.43,88.150002,72.79734,18739100,Bank On The Best: JPMorgan Chase & Company - Forbes,0
1694,2017-02-10,87.480003,87.480003,86.889999,87.0,71.847595,10992500,"""jp-morgan-chase-stock-2017"" - Google News",0
1695,2017-02-09,85.959999,87.330002,85.959999,87.199997,72.012779,13749100,JPMorgan Chase (JPM) Q3 2023 Earnings Call Transcript - The Motley Fool,0
1696,2017-02-08,86.18,86.309998,85.370003,85.959999,70.988747,13970900,"Venezuela, PDVSA Bonds Put on Watch for Key JPMorgan Indexes - Bloomberg",0
1697,2017-02-07,87.139999,87.400002,86.480003,86.720001,71.616348,9392800,JPM vs. BAC: Which Bank Stock is the Better Buy? - TipRanks.com - TipRanks,0
1698,2017-02-06,86.790001,87.449997,86.610001,86.769997,71.657661,11828400,Former crypto day traders say 'no thanks' even as Bitcoin roars back - Yahoo Finance,0
1699,2017-02-03,86.190002,87.309998,85.870003,87.18,71.996254,17885200,"Earnings call: ICE Reports Record Q3 2023 Earnings, Driven by ... - Investing.com",0
1700,2017-02-02,84.339996,84.910004,84.160004,84.589996,69.857346,11081400,Audacy's Clock Runs Out With NYSE As It Gets More Time From Its ... - Insideradio.com,-1
1701,2017-02-01,85.540001,86.099998,84.68,84.949997,70.154633,15430900,"Equity hedge funds cut risk in portfolios, less confidence in rallies By ... - Investing.com",0
1702,2017-01-31,85.599998,86.150002,84.089996,84.629997,69.890373,15655100,Richest Cities in Every State in the US - Yahoo Finance,0
1703,2017-01-30,86.190002,86.5,85.32,86.029999,71.046555,13661900,"Goldman, JPMorgan, Morgan Stanley, UBS in $499 mln stock ... - Reuters.com",0
1704,2017-01-27,86.660004,86.980003,86.269997,86.93,71.78981,12535400,First Republic seized by regulators and sold to JPMorgan Chase - The Washington Post,1
1705,2017-01-26,85.949997,86.949997,85.949997,86.75,71.641151,15962800,"JPMorgan to expand online bank Chase to Germany, EU ... - Reuters.com",0
1706,2017-01-25,85.839996,86.169998,85.169998,86.029999,71.046555,17551000,"Do People Still Go To The Bank? Yes, Says JPMorgan As It Plans ... - Investopedia",-1
1707,2017-01-24,83.919998,85.0,83.559998,84.720001,69.964699,15175300,JPMorgan cuts nearly 40 investment bankers in US - Reuters,1
1708,2017-01-23,83.300003,84.0,83.209999,83.709999,69.130615,12179200,"Why we think now is a good time to invest, in 6 charts - JP Morgan Private Bank",0
1709,2017-01-20,83.43,83.830002,83.290001,83.669998,69.097595,18436800,JPMorgan Reaches $290 Million Settlement With Epstein’s Victims - The New York Times,-1
1710,2017-01-19,84.059998,84.669998,83.120003,83.300003,68.792023,16555600,JPMorgan: Some reasons to be bearish on the red-hot stock market - Yahoo Finance,0
1711,2017-01-18,83.629997,84.230003,83.029999,83.940002,69.320564,21270100,Stocks in Focus on Dow Jones ETF's First 9-Day Run Since 2017 - Yahoo Finance,0
1712,2017-01-17,84.93,85.220001,83.279999,83.550003,68.998482,30024600,SITE Centers Announces Spin-Off of Convenience Portfolio - Business Wire,0
1713,2017-01-13,87.110001,88.169998,86.099998,86.699997,71.599876,28296000,JPMorgan's top trader sees China as biggest overseas opportunity - Reuters,0
1714,2017-01-12,86.760002,87.269997,86.019997,86.239998,71.219963,21337400,JPMorgan ending banking relationship with crypto exchange Gemini ... - Reuters,0
1715,2017-01-11,86.43,87.080002,85.910004,87.080002,71.913696,14713100,"JPMorgan CEO Jamie Dimon 'knew in 2008' that Epstein was a sex trafficker, lawyer argues - CNBC",0
1716,2017-01-10,86.07,86.900002,85.720001,86.43,71.376884,13989000,JPMorgan Chase Assumes Ownership of Distressed D.C. Office Property - Yahoo Finance,0
1717,2017-01-09,85.730003,86.769997,85.519997,86.18,71.170418,12806600,4 charts to help put today's turmoil in perspective - JP Morgan Private Bank,-1
1718,2017-01-06,86.389999,86.620003,85.940002,86.120003,71.120872,12893300,JPMorgan CFO sees nearly 20% drop in banking revenue in first ... - Reuters,0
1719,2017-01-05,86.809998,87.110001,85.260002,86.110001,71.112617,14300800,JPMorgan Chase CEO Jamie Dimon to be deposed in Epstein suit - Yahoo Finance,0
1720,2017-01-04,86.959999,87.18,86.400002,86.910004,71.773285,15266600,'Big Short' Burry Gambled Big on Troubled Bank. The Bet Went Wrong - TheStreet,1
1721,2017-01-03,87.339996,87.760002,85.980003,87.230003,71.641174,20550700,"J.P. Morgan agrees to acquire Global Shares, a leading provider of ... - JPMorgan Chase",0
1722,2016-12-30,86.099998,86.419998,85.660004,86.290001,70.869141,13617800,JPMorgan Chase Announces 2017 Investor Day - JPMorgan Chase,0
1723,2016-12-29,86.580002,86.669998,85.040001,85.889999,70.540619,14689000,JP Morgan agrees to acquire Global Shares - JPMorgan Chase,0
1724,2016-12-28,87.160004,87.389999,86.349998,86.5,71.041595,9455600,Is JPMorgan Chase Stock a Buy? - The Motley Fool,0
1725,2016-12-27,87.050003,87.160004,86.75,87.129997,71.559013,6946400,Is JPMorgan Chase Stock a Buy Right Now? - The Motley Fool,0
1726,2016-12-23,87.0,87.150002,86.400002,87.050003,71.493317,10759400,"Just 10% of trading is regular stock picking, JPMorgan estimates - CNBC",0
1727,2016-12-22,86.440002,87.169998,86.209999,86.889999,71.361908,13924200,Health Care Conference - JP Morgan,0
1728,2016-12-21,86.43,86.809998,86.029999,86.75,71.246933,11400500,JPMorgan launches new real-time payments service - Reuters,1
1729,2016-12-20,85.790001,86.540001,85.550003,86.529999,71.066238,14587300,JP Morgan earnings top expectations after tax bill charge - CNBC,0
1730,2016-12-19,84.800003,85.440002,84.190002,85.43,70.162819,21685100,Why Shares of JPMorgan Chase Are Falling Today - The Motley Fool,0
1731,2016-12-16,86.290001,86.290001,84.889999,84.940002,69.760399,23008500,JPMorgan Chase & Co. (JPM) Stock Rolls Toward $100 Per Share - U.S News & World Report Money,1
1732,2016-12-15,85.400002,86.489998,84.900002,86.0,70.630989,19438900,"JPMorgan Chase earnings: $1.65 per share, vs. expected EPS of $1.52 - CNBC",1
1733,2016-12-14,83.879997,86.120003,83.760002,84.730003,69.587929,22622600,JPMorgan Chase is buying college financial aid platform Frank to deepen ties with students - CNBC,0
1734,2016-12-13,84.980003,85.669998,83.82,84.760002,69.612564,16669000,The SEC Is Allowing 5-Count Felon JPMorgan Chase to Trade Its ... - Wall Street On Parade,0
1735,2016-12-12,85.360001,85.790001,84.290001,84.730003,69.587929,14511300,Bank of America vs. JPMorgan Chase: Who Has the Better Deposit ... - Nasdaq,0
1736,2016-12-09,85.019997,85.5,84.139999,85.489998,70.21209,14567200,Is JPMorgan Chase Stock a Buy in July? - The Motley Fool,0
1737,2016-12-08,84.230003,85.5,83.940002,85.120003,69.908226,20844900,Eye on the Market - JP Morgan Private Bank,0
1738,2016-12-07,83.550003,84.089996,82.849998,84.07,69.045876,18996900,JPMorgan Chase to Liquidate Seven Capital Trusts Resulting in the ... - JPMorgan Chase,0
1739,2016-12-06,83.599998,83.809998,82.43,83.690002,68.733788,16130000,JPMorgan Software Does in Seconds What Took Lawyers 360000 ... - Bloomberg,0
1740,2016-12-05,82.300003,83.290001,82.290001,83.260002,68.38063,18529800,JPMorgan Chase Stock History: How the Big Bank Reached Record ... - The Motley Fool,0
1741,2016-12-02,81.800003,81.830002,80.900002,81.599998,67.017281,16931500,J.P. Morgan Germany | About us - JP Morgan,0
1742,2016-12-01,80.650002,82.279999,80.650002,81.790001,67.173317,23823600,When Will JPMorgan Chase Split Its Stock Again? - The Motley Fool,0
1743,2016-11-30,79.919998,80.529999,79.699997,80.169998,65.842827,25351900,JPMorgan Chase Releases Carbon Reduction Targets for Paris ... - JPMorgan Chase,0
1744,2016-11-29,78.389999,79.160004,78.389999,78.919998,64.816231,14144100,JPMorgan Chase 2018 Investor Day - JPMorgan Chase,0
1745,2016-11-28,78.18,78.870003,78.019997,78.32,64.323441,13007200,Jamie Dimon's infamous 2017 bitcoin takedown still serves as a warning as the decade winds down - CNBC,0
1746,2016-11-25,79.099998,79.449997,78.470001,78.830002,64.742294,6185700,J.P. Morgan Peru | About us - JP Morgan,0
1747,2016-11-23,78.870003,79.239998,77.889999,78.860001,64.766945,13373700,Why Stock Buybacks Are Dangerous for the Economy - HBR.org Daily,0
1748,2016-11-22,78.349998,78.559998,77.760002,78.529999,64.495934,14410100,Expertise for Substantial Wealth - JP Morgan,0
1749,2016-11-21,78.0,78.169998,77.290001,78.050003,64.101707,11983500,Employee Stock Ownership Plans and ESOP Financing - JP Morgan,0
1750,2016-11-18,77.959999,78.419998,77.550003,77.709999,63.82246,19770000,Meet You InvestSM: A New Way to Trade Online Commission-Free - JPMorgan Chase,0
1751,2016-11-17,77.93,78.459999,77.599998,78.019997,64.077057,19306700,JPMorgan Chase's Full-Year Outlook Looks Promising - Yahoo Finance,0
1752,2016-11-16,78.220001,78.349998,76.879997,77.400002,63.567871,26054900,JPMorgan Chase to Present at the Wells Fargo Investment Thought ... - JPMorgan Chase,0
1753,2016-11-15,78.370003,79.410004,77.779999,79.360001,65.177597,28126300,Jamie Dimon And JPMorgan Chase Send Conflicting Signals On ... - Investing.com,0
1754,2016-11-14,77.25,80.440002,77.25,79.510002,65.300789,46130700,Why Does JPMorgan Chase’s Stock Seem so Cheap? - The Motley Fool,0
1755,2016-11-11,76.300003,76.720001,75.769997,76.690002,62.984776,27574300,J.P. Morgan Malaysia | About us - JP Morgan,0
1756,2016-11-10,74.220001,77.25,74.220001,76.650002,62.951916,56192300,"JPMorgan Chase takes on Square and PayPal with smartphone card reader, faster deposits for merchants - CNBC",0
1757,2016-11-09,71.459999,74.150002,71.32,73.25,60.159519,50948400,7 Companies Owned by JPMorgan Chase & Co. - Investopedia,0
1758,2016-11-08,69.699997,70.550003,69.239998,70.029999,57.514954,17531700,J.P. Morgan Australia & New Zealand | About us - JP Morgan,1
1759,2016-11-07,69.080002,69.970001,69.0,69.879997,57.39175,16515100,JP Morgan first-quarter profit easily tops expectations - CNBC,0
1760,2016-11-04,68.489998,68.559998,67.639999,67.760002,55.65062,13571300,Jamie Dimon's $13 Billion Secret—Revealed - Vanity Fair,0
1761,2016-11-03,68.860001,69.190002,68.220001,68.379997,56.159828,10369700,JPMorgan buys fintech start-up WePay - CNBC,0
1762,2016-11-02,68.650002,68.849998,68.010002,68.68,56.406204,12449800,How Long Will It Take JPMorgan Chase's Stock to Double? - The Motley Fool,0
1763,2016-11-01,69.480003,69.779999,68.330002,68.970001,56.644394,15564500,TMC Conference - JP Morgan,0
1764,2016-10-31,69.43,69.580002,69.230003,69.260002,56.882561,14336300,JPMORGAN UNLEASHED: Bank commits to largest buyback since crisis - CNBC,0
1765,2016-10-28,69.529999,69.550003,68.470001,69.110001,56.759384,12766500,"Haven, the Amazon-Berkshire-JPMorgan venture to disrupt health care, is disbanding after 3 years - CNBC",0
1766,2016-10-27,69.489998,69.769997,69.099998,69.230003,56.857922,14210700,J.P. Morgan United Kingdom | About us - JP Morgan,0
1767,2016-10-26,68.370003,69.25,68.370003,69.129997,56.775791,9801300,El Paso Electric's $4.3B sale to JPMorgan-tied fund completed; new ... - El Paso Times,0
1768,2016-10-25,68.879997,68.93,68.379997,68.800003,56.504757,9945100,Is The Top Bank Stock A Buy After Reclaiming This Support Level? - Investor's Business Daily,0
1769,2016-10-24,68.970001,69.050003,68.5,68.870003,56.562256,10197100,JPMorgan Plans to Charge $10000 for Entry-Level Equity Research - Bloomberg,0
1770,2016-10-21,67.809998,68.529999,67.699997,68.489998,56.250168,12175700,JPMorgan set to pay nearly $1 billion in spoofing penalty: source - Reuters,0
1771,2016-10-20,68.080002,68.68,67.940002,68.260002,56.061275,14122000,How Does JPMorgan Chase Make Money? - The Motley Fool,0
1772,2016-10-19,67.809998,68.5,67.809998,68.349998,56.135178,12705800,JP Morgan vs. Goldman Sachs: Performance and Outlook - Investopedia,0
1773,2016-10-18,67.849998,68.209999,67.540001,67.699997,55.601349,11870300,Chase Had Ads on 400000 Sites. Then on Just 5000. Same Results ... - The New York Times,0
1774,2016-10-17,67.419998,67.790001,66.739998,67.169998,55.166061,14963400,JPMorgan Chase Appoints Daniel Pinto and Gordon Smith as Co ... - JPMorgan Chase,0
1775,2016-10-14,68.800003,69.029999,67.300003,67.519997,55.453533,24163800,JP Morgan Chase admits to US market manipulation and agrees to pay $920m - The Guardian,0
1776,2016-10-13,67.459999,67.870003,66.82,67.739998,55.634197,17890000,JPMorgan Grew Its Market Share In U.S. Credit Card Market In Q2 - Trefis,1
1777,2016-10-12,68.260002,68.589996,68.050003,68.129997,55.954502,11899800,"JPMorgan says bitcoin could rise to $146,000 long term as it competes with gold - CNBC",1
1778,2016-10-11,68.5,68.82,67.93,68.309998,56.102337,15657100,JPMorgan makes Salesforce a top pick for 2017 as an artificial ... - CNBC,0
1779,2016-10-10,68.339996,69.059998,68.230003,68.639999,56.373363,13027500,Will JPMorgan Chase Do a Stock Split in 2018? - The Motley Fool,0
1780,2016-10-07,67.790001,68.18,67.400002,68.110001,55.93808,18497000,JP Morgan buys health-care payments firm InstaMed in the bank's biggest acquisition since the financial crisis - CNBC,0
1781,2016-10-06,67.730003,67.970001,67.050003,67.870003,55.740971,17485000,Is JPMorgan Chase Stock Cheap or Expensive? - Yahoo Finance,0
1782,2016-10-05,66.889999,68.07,66.800003,67.690002,55.593147,16280000,JPMorgan launches new algo-driven 'dark pool' for stocks - Reuters,0
1783,2016-10-04,66.209999,67.18,66.099998,66.599998,54.697922,17226900,"Stocks making the biggest moves midday: Nikola, JPMorgan Chase, Roku, Apple, Delta & more - CNBC",0
1784,2016-10-03,66.349998,66.919998,66.260002,66.510002,54.229797,14901700,JPMorgan's Dimon betting on blockchain even as he calls bitcoin ... - CNBC,0
1785,2016-09-30,66.080002,67.059998,66.080002,66.589996,54.295025,21680100,JPMorgan is creating its own cryptocurrency - CNN,0
1786,2016-09-29,66.699997,67.209999,65.349998,65.650002,53.528587,18727200,JPMorgan Chase CEO Jamie Dimon speaks on repatriation - CNBC,0
1787,2016-09-28,66.580002,66.769997,65.989998,66.709999,54.392876,11278000,JPMorgan Chase Acquires WePay: What Investors Need to Know - The Motley Fool,0
1788,2016-09-27,65.410004,66.410004,65.110001,66.360001,54.107494,13711400,This Rewards Card Is a Huge Success for JPMorgan Chase - The Motley Fool,0
1789,2016-09-26,66.599998,66.800003,65.540001,65.779999,53.634579,16408100,JPMorgan takes AI use to the next level - Business Insider,0
1790,2016-09-23,67.389999,67.900002,67.18,67.25,54.833172,13967400,What Is JPMorgan Chase's Most Efficient Operating Segment? - The Motley Fool,0
1791,2016-09-22,66.989998,67.419998,66.839996,67.389999,54.947327,12781700,How Amazon Rattles Other Companies - The New York Times,0
1792,2016-09-21,66.839996,67.129997,66.309998,66.839996,54.498875,14116800,What Is JPMorgan Chase's Most Profitable Segment? - The Motley Fool,0
1793,2016-09-20,66.75,66.849998,66.239998,66.459999,54.18903,10092200,J.P. Morgan Set to Run First Apps in Public Cloud - Wall Street Journal,0
1794,2016-09-19,66.150002,66.639999,65.849998,66.190002,53.96888,13466900,The Real Reason Jamie Dimon Went Berserk About America's ... - Vanity Fair,0
1795,2016-09-16,66.089996,66.260002,65.440002,65.82,53.667194,25161500,"""jp-morgan-chase-stock-2018"" - Google News",0
1796,2016-09-15,66.290001,66.93,66.089996,66.639999,54.335804,12531300,JPMorgan Chase (JPM) Q3 2023 Earnings Call Transcript - The Motley Fool,0
1797,2016-09-14,66.269997,67.25,66.209999,66.400002,54.140102,12648600,JPMorgan Chase's Seattle tech hub tops 320 people amid broader ... - GeekWire,0
1798,2016-09-13,66.110001,66.860001,65.82,66.529999,54.246113,18876100,Form 424B2 JPMORGAN CHASE & CO - StreetInsider.com,0
1799,2016-09-12,66.139999,67.300003,65.760002,67.059998,54.67823,16453000,Morgan Stanley hands new leaders tens of millions in restricted stock - Financial Times,0
1800,2016-09-09,67.029999,67.43,66.639999,66.650002,54.343948,19686900,Citigroup Upgrades Cedar Fair (FUN) - Nasdaq,0
1801,2016-09-08,67.220001,67.68,67.0,67.25,54.833172,12253000,"Hedge funds trim exposure to megacap tech stocks, banks say - Reuters",0
1802,2016-09-07,67.160004,67.589996,66.959999,67.160004,54.759792,10070400,"Stock, bond markets jump on a Fed-is-done trade that may be too ... - Morningstar",0
1803,2016-09-06,67.5,67.550003,66.709999,67.440002,54.988083,16649400,DraftKings (DKNG) Q3 2023 Earnings Call Transcript - The Motley Fool,0
1804,2016-09-02,67.400002,67.580002,66.980003,67.489998,55.028854,13720700,Tesla to hand over Musk's emails to JPMorgan in lawsuit over 2018 ... - Reuters,0
1805,2016-09-01,67.639999,67.720001,66.650002,67.209999,54.800541,12226500,"SEC fines JPMorgan subsidiary for deleting 47 million emails, some related to subpoenas - CNBC",0
1806,2016-08-31,67.459999,67.769997,66.860001,67.5,55.037006,14952300,The latest on JPMorgan Chase takeover of First Republic Bank: Live updates - CNN,0
1807,2016-08-30,66.949997,67.599998,66.949997,67.5,55.037006,13791200,"Letter to Shareholders from Jamie Dimon, Annual Report 2022 - JPMorgan Chase",0
1808,2016-08-29,66.489998,67.099998,66.459999,66.949997,54.588558,14583100,JPMorgan Chase Bank Review | U.S. News - U.S. News & World Report,0
1809,2016-08-26,66.330002,66.879997,65.849998,66.220001,53.993351,14038600,Here Are 5 Reasons to Invest in JPMorgan (JPM) Stock Now - Yahoo Finance,0
1810,2016-08-25,65.910004,66.139999,65.790001,66.07,53.871033,9978700,JPMorgan fined $4 million for deleting 47 million emails including some requested in subpoenas - CNN,0
1811,2016-08-24,65.989998,66.230003,65.769997,65.949997,53.773186,10167200,JPMorgan Reaches $290 Million Settlement With Epstein’s Victims - The New York Times,-1
1812,2016-08-23,66.07,66.339996,65.760002,65.769997,53.626431,8949600,JPMorgan Chase is fined by SEC after mistakenly deleting 47 million emails - Yahoo Finance,1
1813,2016-08-22,65.75,65.879997,65.410004,65.800003,53.650883,9055600,JPMorgan second quarter profit jumps 67% with a boost from First Republic takeover - Yahoo Finance,0
1814,2016-08-19,65.720001,65.910004,65.220001,65.860001,53.699818,9084900,JPMorgan Strategist Kolanovic Warns of 'Volmageddon 2.0' Risk in ... - Bloomberg,0
1815,2016-08-18,65.620003,65.989998,65.529999,65.949997,53.773186,9313600,America's Biggest Bank Is Everywhere—and It Isn't Done Growing - The Wall Street Journal,0
1816,2016-08-17,65.800003,65.980003,65.540001,65.889999,53.724277,11868100,Here Are 5 Reasons to Invest in JPMorgan (JPM) Stock Now - Nasdaq,0
1817,2016-08-16,65.360001,65.959999,65.239998,65.709999,53.577496,10128900,Here's Why JPMorgan (JPM) Stock is a Compelling Buy Right Now - Nasdaq,0
1818,2016-08-15,65.559998,65.830002,65.459999,65.720001,53.585655,8371600,ESG Solutions - Investment Banking - JP Morgan,0
1819,2016-08-12,64.970001,65.349998,64.860001,65.32,53.259514,7685400,"Jamie Dimon, America’s top banker, has 'no plans’ to run for office - CNBC",0
1820,2016-08-11,65.269997,65.690002,65.019997,65.459999,53.373665,9604500,JPMorgan Chase Elects Alicia Boler Davis to its Board of Directors - JPMorgan Chase,0
1821,2016-08-10,65.919998,66.07,65.160004,65.279999,53.226898,11556100,JPMorgan Chase settles Jeffrey Epstein sex trafficking suit by U.S. Virgin Islands for $75 million - CNBC,1
1822,2016-08-09,66.18,66.279999,65.690002,65.870003,53.707973,10097000,"Why we think now is a good time to invest, in 6 charts - JP Morgan Private Bank",0
1823,2016-08-08,66.07,66.489998,65.839996,66.099998,53.895508,11359200,"J.P. Morgan to Acquire Aumni, a Leading Provider of Investment ... - JP Morgan",0
1824,2016-08-05,65.139999,66.370003,65.07,66.300003,54.058575,20752700,JPMorgan Chase buys data platform for startups in push to serve venture capital investors - CNBC,0
1825,2016-08-04,64.489998,64.82,64.269997,64.559998,52.639839,9873000,Exclusive: JP Morgan says client shares in Russia's Magnit may be ... - Reuters,-1
1826,2016-08-03,63.689999,64.669998,63.650002,64.660004,52.721382,13122300,How a startup CEO was accused of $175M fraud while denying she made up her success - ABC News,1
1827,2016-08-02,63.59,64.010002,63.380001,63.650002,51.897858,13550000,The Rasputin Effect: Global resilience to higher rates - JP Morgan Private Bank,0
1828,2016-08-01,64.150002,64.309998,63.610001,63.799999,52.020164,11422600,"If You Invested $1,000 in U.S. Bank in 2018, This Is How Much You ... - The Motley Fool",0
1829,2016-07-29,63.799999,64.290001,63.75,63.970001,52.158775,13210400,"JPMorgan (JPM) to Expand Presence in Carolinas, Add Branches - Yahoo Finance",0
1830,2016-07-28,64.0,64.190002,63.720001,64.099998,52.264771,10013400,"Goldman Sachs, JPMorgan stake competing claims to No. 1 deal ... - Reuters",0
1831,2016-07-27,64.080002,64.690002,64.059998,64.330002,52.452312,11806800,RESEARCH Downtown Downturn: The Covid Shock to Brick-and ... - JPMorgan Chase,1
1832,2016-07-26,63.98,64.260002,63.709999,64.129997,52.289223,8067800,A shift in market leadership - JP Morgan Private Bank,1
1833,2016-07-25,63.98,64.169998,63.68,63.869999,52.077244,8168300,"With First Republic deal, Jamie Dimon finally becomes a big ... - The Boston Globe",1
1834,2016-07-22,63.900002,64.089996,63.599998,64.040001,52.215851,8195700,The opportunity in renewed U.S. industrial policy - JP Morgan Private Bank,0
1835,2016-07-21,64.0,64.18,63.630001,63.689999,51.930462,9808700,Investing in Japan’s bright spots: Tourism and batteries - JP Morgan Private Bank,0
1836,2016-07-20,64.110001,64.230003,63.709999,63.93,52.12616,10411100,JPMorgan’s top strategist warns markets could be heading for another ‘Volmageddon’ - Fortune,0
1837,2016-07-19,63.610001,64.099998,63.459999,63.860001,52.069088,9737400,JPMorgan Chase (JPM) Testing 2020's All-Time High - Investopedia,0
